{
  "event_id": "e8e52d2b-7ac0-5f6f-9038-fab8032f18a6",
  "event_type": "market.trade.raw",
  "schema_version": "v1",
  "exchange": "coinbase",
  "symbol": "BTC-USD",
  "event_time": "2026-08-11T15:30:00Z",
  "ingested_at": "2026-08-11T15:30:00.125Z",
  "source_event_id": "123456789",
  "source_sequence": 42,
  "producer": "apps.collector",
  "trace_id": "f7097ca7-f8a8-4319-87c7-dfb42d84ad74",
  "correlation_id": null,
  "causation_id": null,
  "payload": {
    "trade_id": "123456789",
    "product_id": "BTC-USD",
    "price": "65000.10",
    "size": "0.001",
    "side": "BUY",
    "time": "2026-08-11T15:30:00Z"
  }
}
